{
  "schema_version": "prman-decision-config/1.0",
  "required_gates": ["scope", "secrets", "tests"],
  "criteria": [
    "correctness",
    "task_alignment",
    "scope",
    "repository_conventions",
    "maintainability",
    "reviewer_effort"
  ],
  "weights": {
    "correctness": 0.28,
    "task_alignment": 0.22,
    "scope": 0.14,
    "repository_conventions": 0.12,
    "maintainability": 0.12,
    "reviewer_effort": 0.12
  },
  "critical_min": {
    "correctness": 0.75,
    "task_alignment": 0.75,
    "scope": 0.65
  },
  "soft_min": {
    "repository_conventions": 0.6,
    "maintainability": 0.6,
    "reviewer_effort": 0.6
  },
  "ready_score": 0.72,
  "revise_floor": 0.48,
  "ready_uncertainty_max": 0.12,
  "abstain_uncertainty": 0.2,
  "top_margin_min": 0.08,
  "max_context_truncation_ratio": 0.4,
  "lcb_uncertainty_weight": 0.75
}
